[
  {
    "doc_id": "D1",
    "title": "乙酰氨基酚不良反应",
    "version": "v1.0.0",
    "creation_time": "2025-09-04T01:13:31.037881Z",
    "last_update_time": "2025-09-04T01:13:31.037881Z",
    "units": [],
    "tags": [],
    "entities": {},
    "content": "乙酰氨基酚常见不良反应包括恶心、皮疹，罕见肝损伤等",
    "source_ref": "source_a1b859593d",
    "compliance_flags": {
      "has_reference_id": true,
      "has_version": true,
      "cross_version_mixed": false
    }
  },
  {
    "doc_id": "D2",
    "title": "布洛芬不良反应",
    "version": "v1.0.0",
    "creation_time": "2025-09-04T01:13:31.041634Z",
    "last_update_time": "2025-09-04T01:13:31.041634Z",
    "units": [],
    "tags": [],
    "entities": {},
    "content": "布洛芬常见不良反应包括胃部不适、头晕，罕见肾损伤等",
    "source_ref": "source_52d8b19cba",
    "compliance_flags": {
      "has_reference_id": true,
      "has_version": true,
      "cross_version_mixed": false
    }
  },
  {
    "doc_id": "D3",
    "title": "阿司匹林不良反应",
    "version": "v1.0.0",
    "creation_time": "2025-09-04T01:13:31.049212Z",
    "last_update_time": "2025-09-04T01:13:31.049212Z",
    "units": [],
    "tags": [],
    "entities": {
      "drug": [
        "aspirin"
      ]
    },
    "content": "阿司匹林常见不良反应包括胃出血风险增加、过敏反应等",
    "source_ref": "source_ac42a7e5a1",
    "compliance_flags": {
      "has_reference_id": true,
      "has_version": true,
      "cross_version_mixed": false
    }
  },
  {
    "doc_id": "D4",
    "title": "对乙酰氨基酚用法用量",
    "version": "v1.0.0",
    "creation_time": "2025-09-04T01:13:31.052895Z",
    "last_update_time": "2025-09-04T01:13:31.052895Z",
    "units": [],
    "tags": [],
    "entities": {},
    "content": "对乙酰氨基酚用于退热镇痛，需遵循说明书剂量",
    "source_ref": "source_ab08545912",
    "compliance_flags": {
      "has_reference_id": true,
      "has_version": true,
      "cross_version_mixed": false
    }
  },
  {
    "doc_id": "D5",
    "title": "布洛芬用法用量",
    "version": "v1.0.0",
    "creation_time": "2025-09-04T01:13:31.056450Z",
    "last_update_time": "2025-09-04T01:13:31.056450Z",
    "units": [],
    "tags": [],
    "entities": {},
    "content": "布洛芬用于镇痛解热，餐后服用以减少胃部刺激",
    "source_ref": "source_c8d9e59a5b",
    "compliance_flags": {
      "has_reference_id": true,
      "has_version": true,
      "cross_version_mixed": false
    }
  },
  {
    "doc_id": "D6",
    "title": "阿司匹林用法用量",
    "version": "v1.0.0",
    "creation_time": "2025-09-04T01:13:31.065664Z",
    "last_update_time": "2025-09-04T01:13:31.065664Z",
    "units": [],
    "tags": [],
    "entities": {
      "drug": [
        "aspirin"
      ]
    },
    "content": "阿司匹林可用于抗血小板聚集，遵照医嘱服用",
    "source_ref": "source_94c1fe7865",
    "compliance_flags": {
      "has_reference_id": true,
      "has_version": true,
      "cross_version_mixed": false
    }
  },
  {
    "doc_id": "D7",
    "title": "扑热息痛适应症",
    "version": "v1.0.0",
    "creation_time": "2025-09-04T01:13:31.069151Z",
    "last_update_time": "2025-09-04T01:13:31.069151Z",
    "units": [],
    "tags": [],
    "entities": {},
    "content": "扑热息痛（即对乙酰氨基酚）用于退热镇痛，适应症广泛",
    "source_ref": "source_784bf0195a",
    "compliance_flags": {
      "has_reference_id": true,
      "has_version": true,
      "cross_version_mixed": false
    }
  },
  {
    "doc_id": "D8",
    "title": "布洛芬适应症",
    "version": "v1.0.0",
    "creation_time": "2025-09-04T01:13:31.072641Z",
    "last_update_time": "2025-09-04T01:13:31.072641Z",
    "units": [],
    "tags": [],
    "entities": {},
    "content": "布洛芬用于轻至中度疼痛、发热等症状的缓解",
    "source_ref": "source_fed513b78f",
    "compliance_flags": {
      "has_reference_id": true,
      "has_version": true,
      "cross_version_mixed": false
    }
  },
  {
    "doc_id": "D9",
    "title": "阿司匹林适应症",
    "version": "v1.0.0",
    "creation_time": "2025-09-04T01:13:31.076720Z",
    "last_update_time": "2025-09-04T01:13:31.076720Z",
    "units": [],
    "tags": [],
    "entities": {
      "drug": [
        "aspirin"
      ]
    },
    "content": "阿司匹林用于减轻疼痛、退热并抑制血小板聚集",
    "source_ref": "source_39003dc5e8",
    "compliance_flags": {
      "has_reference_id": true,
      "has_version": true,
      "cross_version_mixed": false
    }
  }
]